count_words,count_mentions,count_hashtags,count_capital_words,count_excl_quest_marks,count_urls,Sentiment,clean_text,clean_count_words
9,2,0,1,6,0,0,rt boy : girl : woman : man : babi : oldwoman : oldman : blond-hairedperson : manwithchinesecap : personwearingturban : constructionwork : guard : princess : policeoffic um no black peopl whitequestionmark : whitequestionmark : whitequestionmark,23
6,1,0,0,0,0,0,boy : girl : woman : man : babi : oldwoman : oldman : blond-hairedperson : manwithchinesecap : personwearingturban : constructionwork : guard : princess : policeoffic um no black peopl whitequestionmark : whitequestionmark : whitequestionmark,22
19,2,3,0,0,1,0,mani compani manag sec vid http bit ly pwlpgq entrepreneur startup pioniq,12
17,4,0,1,0,0,0,xd that back pc… incas hide gun,7
22,1,1,0,1,0,0,pleas provid support bangla keyboard io would make life mani bengali io user easier iphon,15
18,2,0,1,0,0,0,sell million first weekend sold million galaxi ii phone global,10
18,1,0,0,1,0,0,hey need server siri traffic sure googl help,8
12,1,1,0,0,0,0,wish someon would gift unlock iphon iphon,7
8,1,0,0,0,0,0,appar not correct,3
28,1,0,1,2,0,0,love love phone ever sinc damn updat text keep say full none problem,13
23,2,1,0,1,0,0,opinion need care patent issu look lot like learn lot make chip,12
24,2,0,1,5,0,0,guarante hd noth rim server failur day million iphon sold day,11
20,5,0,1,0,1,0,rt princip global player activ everi market http co,9
14,3,1,1,0,0,0,rt underplay power ipad via lt yup socapac,8
18,2,0,1,1,1,0,ya hoo sell million iphon day http co rvdjsmmi via aapl,11
12,2,1,0,0,0,0,underplay power ipad via lt yup socapac,7
20,4,2,0,0,1,0,princip global player activ everi market http co ndxcmo dbw metacon,11
21,1,0,0,1,0,0,dear invis intern assist pleas go pick comput hospit upgrad io thank,12
22,1,4,0,0,0,0,siri could done not great iphon hear iphon come inc,10
15,1,0,0,0,1,0,wow sold million iphon singl weekend http co wdlhzsza,9
22,2,0,1,0,0,0,oh sale guy not sell use product mourn period job pass hmmm,12
27,1,0,0,0,0,0,wish ipod featur dock scroll artist album song titl huge font across,12
9,1,1,0,0,0,0,main offic nowplay milli lil wayn,6
9,3,1,1,0,0,0,ibm iphon siri not watson,5
26,2,0,1,1,0,0,rt leav steve photo home page would realli want honor let get back innovati,14
26,2,1,1,1,0,0,rt leav steve photo home page would realli want honor let get back innov,14
26,2,0,0,3,0,0,leav steve photo home page would realli want honor let get back innov eh,14
25,2,0,0,1,0,0,sold retail duhhhh also woz correct peopl dont want tech answer simpl child like one ok,16
26,1,0,0,0,0,0,store wait poorli imac seen geniu hope painless not bad,10
22,2,1,0,1,0,0,sure io integr would greatli benefit move least keyboard page simpleth,11
19,2,0,0,0,0,0,incred peopl still buy appl world beater not true anymor,10
11,1,0,0,0,0,0,disappoint hogwart not choic world clock iphon,7
23,2,1,1,0,1,0,great video predict tablet form siri end articl rt cont http co rdbeuctt,13
17,1,3,1,0,1,0,ih iphon show key design compon chang http co tfigidv appl iphom io,13
17,1,3,1,0,1,0,ih iphon show key design compon chang http co gzmdzvle appl iphom io,13
17,1,3,1,0,1,0,ih iphon show key design compon chang http co uxfaukg appl iphom io,13
17,1,3,1,0,1,0,ih iphon show key design compon chang http co ymaliy appl iphom io,13
20,2,0,1,0,0,0,rt appl announc sold million phone weekend incred recess continu bite,11
20,5,0,0,1,1,0,great post upcom great tech war http co oseqhtw via,10
20,2,0,1,0,0,0,rt appl announc sold million phone weekend incred recess continu bite,11
19,1,1,0,0,0,0,appl announc sold million phone weekend incred recess continu bite recess,11
16,2,0,1,0,1,0,rt iphon first weekend sale top four million http co ozqnyk via,12
12,2,0,1,1,0,0,rt dear get afro american emoticon manag,7
18,2,3,0,1,1,0,breakingnew report iphon sold million weekend truestori http co bejsa,10
14,1,0,0,0,1,0,iphon first weekend sale top four million http co ozqnyk via,11
15,2,4,1,0,1,0,video siri also get angri http co ksxxzor appl siri iphon ai,12
15,2,4,1,0,1,0,video siri also get angri http co kuwx appl siri iphon ai,12
15,2,4,1,0,1,0,video siri also get angri http co xxchzbn appl siri iphon ai,12
15,2,4,1,0,1,0,video siri also get angri http co tzigdb appl siri iphon ai,12
23,2,0,0,1,0,0,hey know ad support yet seem like odd omiss advanc devic,11
26,2,0,2,2,0,0,realli remov edg switch io realiz work network place often right,11
19,1,2,2,0,1,0,appl sold four million iphon first weekend http co dduqmo via phonerecord twiceiphonesal,13
17,2,3,1,0,1,0,iphon mp camera it´ soni http co xjhnzu appl iphon camera,11
17,2,3,1,0,1,0,iphon mp camera it´ soni http co uyizeak appl iphon camera,11
17,2,3,1,0,1,0,iphon mp camera it´ soni http co njthoix appl iphon camera,11
17,2,3,1,0,1,0,iphon mp camera it´ soni http co biqbehtb appl iphon camera,11
11,2,1,0,2,0,0,purchas imac ipad printer studentdiscount,5
15,1,3,1,0,1,0,iphon setup siri tweet http co fzoij appl iphon siri,10
15,1,3,1,0,1,0,iphon setup siri tweet http co eyhmhstm appl iphon siri,10
15,1,3,1,0,1,0,iphon setup siri tweet http co wslint appl iphon siri,10
15,1,3,1,0,1,0,iphon setup siri tweet http co uecqhlk appl iphon siri,10
28,1,0,0,0,0,0,ever sinc clean mighti mous ball alcohol get roll time click ball act like left click,16
15,1,0,0,1,1,0,siri avail iphon http co qzungylw,6
19,2,0,1,2,0,0,lol look like rt dear get afro american emoticon manag,10
12,2,0,0,0,1,0,cool steve job infograph http co prbyxx timelin histori,9
13,2,0,0,0,0,0,talk keynot lunch challeng check someth,6
24,1,0,0,1,0,0,iphon no longer stupid network lost pop possibl annoy thing ever not turn,13
15,1,2,0,0,1,0,steve last design appar appl iphon http co difqtmwm,9
23,1,0,3,2,0,0,ok accessori polici hand need power line use mic kid,10
22,2,1,0,0,0,0,court sydney ban sale galaxi tab australia intellectu properti infring claim ip war,13
16,1,2,0,0,0,0,receiv pre order singl day new iphon consum demand steve job,11
14,1,0,0,1,0,0,get iphon stop vibrat get text,6
20,3,2,0,1,1,0,win ipod touch get hello world babi memori app http co qeatnmpi pampershelloapp,13
22,1,2,0,2,1,0,siri iphon allow unauthor access text email even phone lock http co qdlt,13
13,1,1,0,1,0,0,sign iclould also get irain icloud,6
14,2,0,0,0,1,0,not like win appstor suit case http co gncdgqsc,9
24,1,3,0,1,0,0,say no thing say no rule success steve job prodmgmt manag innov,12
6,2,0,0,0,0,0,ok back,2
8,1,1,0,0,0,0,cat accus tiger roar samsung,5
11,2,0,0,0,0,0,need partner app store,4
25,2,0,0,0,0,0,stuck unveil icloud show placement name even fail effort yield success,11
15,2,2,0,0,1,0,right left last week iphon appl http co ksjhba,9
10,2,0,0,0,0,0,think call profit make geniu,5
13,1,3,0,1,0,0,stock go stevejob death appl applestock,6
26,1,0,0,0,0,0,need take steve job tribut get back promot brand put cloud front page start explain,15
19,2,3,0,1,0,0,better everi magazin app support magazin ipad upgrad add newsstand app,11
10,2,0,0,1,0,0,busi slappi hissi fit samsung,5
19,1,0,0,0,0,0,fregon el nuevo facebook para ipod iphon haha alomejor ya tien rato pero yo lo acabo de actualizar,18
15,2,0,1,1,0,0,rt siri keep tri send escort servic legal,8
13,1,0,0,1,0,0,siri keep tri send escort servic legal,7
17,2,0,0,0,0,0,watch igeniu base first minut never gone public,8
16,1,0,0,0,0,0,ok lion not leopard much upgrad weekend,7
18,2,0,0,0,0,0,well mayb would set ya product send push notif would go,11
16,1,4,0,0,0,0,siri great googl android alway function youtu ggbyvvuz justsay,9
20,3,2,0,1,1,0,win ipod touch get hello world babi memori app http co zrbakkl pampershelloapp,13
12,1,0,0,0,0,0,hmm seem check ident first…,5
26,1,0,0,0,1,0,respect realli think appl logo revis one no doubt seen… http co xnkwgxme,13
20,3,2,0,1,1,0,win ipod touch get hello world babi memori app http co eniacwr pampershelloapp,13
17,2,0,0,2,0,0,know first home comput use mous call lisa,8
27,1,0,0,2,1,0,not buy enough ipad alreadi give us break learn cope post steve appl http co wgtxqz,16
21,1,0,8,0,0,0,not buy iphon store not made yet defraud,8
17,1,1,0,0,0,0,need give contract deal get new custom time teamiphone,9
5,2,0,1,0,0,0,vs win,2
12,1,2,0,0,1,0,steve job biopic come soon appl stevejob http co dxzbabg,10
26,3,0,0,0,0,0,ye salut steve job tweet watch ipad let go schaub time lead,12
25,1,0,2,2,1,0,wow dog starr earlier upstair huge soho store sudden sprung attent http co bplmyvd,14
15,1,0,0,0,1,0,digit worldwid today steve job day california http co qschumin,10
19,2,0,1,0,1,0,watch webcast joseph ipad tv love technolog http co mpbzyl,10
16,3,1,0,1,0,0,compar app interfac anyon imagin could done wors sadreal,9
13,2,0,0,0,1,0,wait patient store http co nafaexuh,6
13,2,0,0,0,1,0,also know no end http co qcbcue,7
14,1,0,0,0,0,0,siri abl help find spot bush leagu,7
4,1,0,0,0,0,0,macbook air satiliktir,3
18,5,2,1,0,0,0,rt princip global player activ everi market fbf publaunch,9
7,2,0,0,0,1,0,http co ycscg via,4
19,1,1,0,0,0,0,told stupid bitch repli insist lol,6
21,1,1,0,1,0,0,check note without mail lion icloud like io devic,9
24,1,1,0,0,0,0,need ask siri favorit color averag speed unladen swallow seem someon monti python fan,14
20,4,2,0,0,1,0,princip global player activ everi market fbf publaunch http co ndxcmo,11
20,2,1,0,0,0,0,publicli denounc file suit buy em cheap siri,8
17,3,1,0,1,0,0,lost lot paid etc nothappi oh well poop happen,9
11,1,1,0,1,0,0,folk awesom glad mactard,4
27,1,1,1,0,0,0,wait end person line check time geniu bar appt store not find system geniu fail,15
21,1,1,1,0,0,0,improv mac os lion great full screen implement monitor broken,10
21,4,0,0,1,0,0,ask us appl read messag twitter appl either,8
18,2,0,0,0,0,0,not heard hubbi no problem not done yet,8
20,3,0,2,0,0,0,rt partnership would great sm io devic would use imessag,10
27,1,4,1,4,0,0,dear still use iweb mobilem websit convert icloud appl id mail ical help dtv thank,15
19,4,2,0,0,1,0,california governor declar today stevejobsday state music video tribut http co mnrhix,12
22,2,0,1,0,0,0,lmao rt ask siri hoe told nearest escort love,9
11,2,1,0,1,0,0,beef cantwealljustgetalong,2
19,1,0,0,0,0,0,ask siri hoe told nearest escort love,7
12,1,1,0,2,0,0,twitpeep everi user like io,5
16,3,2,0,1,0,0,done prase io everyon go subscrib notsosuperpro shamlessselfpromot,8
17,3,2,1,1,0,0,rt done prase io everyon go subscrib notsosuperpro shamlessselfpromot,9
15,2,2,0,1,0,0,done prase io everyon go subscrib notsosuperpro shamlessselfpromot,8
11,2,0,0,0,0,0,shit hard chang twitter name,5
7,1,0,0,1,0,0,want siri iphon,3
28,1,0,1,1,0,0,new imessag great way default sm not wifi limit data,10
22,1,0,0,0,1,0,right migrat older mbp imac use ethernet not firewir thank drew save http co iahhagxi,15
19,1,0,1,1,0,0,dear yesterday suck today awesom thank lp appl store crash burn mich ave store,14
19,3,2,0,0,1,0,store towson wait geniu bar huge crowd wait iphon http co xswech,12
12,1,0,0,0,1,0,steve job get day pcworld http co gtwod,8
12,1,0,0,0,0,0,back futur even iphon,4
18,1,1,0,1,0,0,merg address search bar safari ala crome io simpleth,9
15,2,1,0,2,0,0,well respond fast io,4
15,3,0,0,1,0,0,total agre talk friend yesterday siri everywher,7
12,1,0,0,1,1,0,much factori cost asymco http co ghtvqmo,7
10,2,0,0,0,1,0,hit court http co lbrfyb,5
27,2,0,0,0,0,0,well told happen would concret evid log life,8
7,1,0,0,14,0,0,pick camera iphon orcamera ipad,5
10,1,0,6,1,0,0,no let pre order iphon,5
11,2,0,0,0,0,0,love iphon blogpost final done iphon app,7
16,1,1,0,1,0,0,someon explain hell imessag differ text messag fb,8
15,1,0,0,1,0,0,someon explain hell imessag differ text messag,7
12,1,1,0,0,0,0,feel free accid ship new iphon nobigd,7
20,1,0,0,2,0,0,ask siri swallow reli let see wtf wank phone,9
20,3,2,0,1,1,0,win ipod touch get hello world babi memori app http co madmqpc pampershelloapp,13
26,1,1,0,3,0,0,much student discount macbook air canada rep said thank laptop,10
16,3,0,0,3,0,0,go provid abil password protect ipad email,7
25,3,0,0,1,0,0,new io chang way ipad charg notic charg laptop iphon charger,11
15,2,1,1,1,0,0,know would awesom sold ipad easi pay yespleas,8
10,1,1,0,0,0,0,thank girlfriend like siri,4
29,1,0,0,1,1,0,store dude hear accent ru no ct ur not st tell dude mayb http co ztjep,16
22,1,3,0,0,1,0,speechtran http co twszx app store list best bi direct speech speech translat post twitter,15
24,2,2,0,0,0,0,chanc check android overhaul ebook like respons newsstand bake io,10
18,1,2,0,0,0,0,no siri support canada suck siri love new iphon upgrad gs iphon,12
14,1,2,0,0,1,0,awesom documentari appl creat stevejob appl http co qetkd,9
8,1,0,0,1,0,0,oop appar handl squatter tweetbarass,5
21,2,1,0,0,1,0,video brought small tear eye http co vaninp watch opinion stevejob,11
12,1,2,0,0,0,0,reader button safari perfect fic io stevejobsday,7
17,2,0,0,0,1,0,macbook pro constrain new model appear appl inventori system http co blgrue,12
12,3,0,0,0,1,0,great iphon review http co gxqyw,6
4,1,0,0,1,0,0,give siri back,3
8,1,0,1,0,0,0,lunch new os iso,4
10,1,0,0,0,1,0,bouquet job store nagoya http co pmecxpug,7
23,1,1,0,0,0,0,new io notif center big improv miss easi trick not make fulli avail lock screen,15
5,1,0,0,0,1,0,http co lkmjzin,3
28,2,0,4,1,0,0,battl voic control ai platform mobil os ind ie antitrust case eu vlingo,13
22,1,3,0,0,1,0,speechtran http co twszx app store list best bi direct speech speech translat post twitter,15
20,3,2,0,1,1,0,win ipod touch get hello world babi memori app http co gihypzwo pampershelloapp,13
26,2,0,2,0,0,0,hide rt dear newsstand advertis magazin free not free also allow us remov app,14
22,3,2,0,1,1,0,win ipod touch get hello world babi memori app http co fnbknwmj pampershelloapp end,14
20,4,2,0,1,1,0,win ipod touch get hello world babi memori app http co qeatnmpi pampershelloapp,13
14,1,0,0,0,0,0,chang homepag steve job look like owl,7
9,3,0,0,0,0,0,want integr siri,3
22,2,0,0,0,0,0,nope even let mom switch upgrad mine til march,9
27,1,0,0,0,0,0,io well good nice new featur still wait app go work,11
23,1,2,0,1,0,0,tribut steve consid renam siri steve get job done forev rememb legaci,12
11,2,0,0,0,0,0,wait integr siri,3
9,2,0,0,0,0,0,use account,2
18,1,3,0,0,0,0,hope releas app siri us non appl user appl iphon siri,11
19,1,2,0,0,0,0,strang not put newsstand app group want new paperboy io iphon,11
24,1,3,1,1,1,0,case curiou like iphon appl iphon best price featur http co dlonczc healthit ehr,14
16,1,0,2,0,0,0,lem say io mad cool need lot bug fix,9
23,1,0,0,3,0,0,get instead drop gb iphon releas gb one,8
7,1,0,0,0,0,0,dear imessag client desktop pleas,5
16,1,1,0,0,0,0,siri kinda slow tho impress got accent command first time,10
14,1,0,2,7,0,0,geniu song watch throne yet huh,6
20,3,2,0,1,1,0,win ipod touch get hello world babi memori app http co eylmpav pampershelloapp,13
22,1,3,0,0,1,0,speechtran http co twszx app store list best bi direct speech speech translat post twitter,15
4,2,0,0,1,0,0,vs iphon,2
3,1,0,1,0,0,0,hq,1
24,1,0,2,0,1,0,trip sf silicon valley end visit hq one final stop http co ikooqdoc,13
11,2,3,0,0,1,0,iphon space http co gloaxhl via nasa,7
23,2,0,1,0,0,0,rt hey iphon iphon steve donat small portion proce toward cancer rese,12
20,3,2,0,1,1,0,win ipod touch get hello world babi memori app http co dllabuak pampershelloapp,13
24,3,0,1,0,0,0,wish would come nativ mac version video editor especi hd video love everyth,13
7,2,0,0,1,0,0,get,1
14,1,0,0,0,0,0,make siri aval devic not exclus iphon,7
12,1,1,0,0,1,0,still line store hillsdal mall http co wzvxnze,8
5,1,0,0,0,1,0,http co awaswvu,3
25,1,1,0,3,0,0,volum control fast app switcher button volum button give bright slider wtf,12
28,2,0,1,1,0,0,proof dad love si rt woke dad door new iphon surpris went,12
7,1,1,0,2,0,0,iphon arriv tuesday iphon,4
10,2,1,0,0,1,0,mani iphon firstworldproblem http co ckyffsi,6
24,1,4,0,2,0,0,dear hoh deaf user pleas add option stronger longer vibrat iphon thank hoh deaf alli,15
7,1,0,0,0,0,0,geniu bar wait store,4
18,3,0,0,0,0,0,no kid also forget stop close app store bloodi purchas,10
13,1,1,0,1,0,0,behind giant silver door store maclif,6
13,3,0,1,0,1,0,url work http co vgsfq,5
19,3,0,0,0,1,0,look samsung chaton tonight promis integr key app http co dzsgphqt,11
9,2,0,1,0,0,0,unlock store rip mr job,5
21,1,0,2,1,0,0,siri cool importantli handi funni pleas configur canada racism eh,10
26,3,0,3,1,0,0,rt yea store open day week rt rt ipad iphon christma gift self,13
10,1,1,0,0,0,0,io need includ landscap mode remind,6
22,1,2,1,0,0,0,de la nada mi iphon se fue negro empezó vibrar hubo que resetearlo que onda con io wtfh,18
11,1,2,0,0,1,0,http co cvekdoiq line northpark dalla mall gsiphon,8
23,2,0,0,1,0,0,sound like nd day strategi work got yesterday no time staff awesom effici,13
17,2,7,0,0,0,0,slow slow slow bewar sign slowsprint iphon iphon iphon siri android thebufferingnetwork,12
9,1,0,0,0,0,0,wait line store west th street,6
11,1,1,0,0,1,0,honor steve job ripstev http co nyjhknou,7
17,1,0,0,1,0,0,gon na updat fact see emoji twitter mac,8
20,2,1,1,0,1,0,rt purdi roger tribut stevejob spray paint macintosh plu http co aldictd,12
20,2,1,1,0,1,0,rt purdi roger tribut stevejob spray paint macintosh plu http co omxjhzh,12
24,1,0,0,3,0,0,io support nd gen ipod discontinu year old give us io updat pleas,13
29,1,0,0,0,0,0,look ebay iphon bid well gb white deliv,8
22,1,2,0,0,1,0,saturdaycut shit siri say design knew peopl go ask new digit assist http co ecjiiio,15
26,2,0,0,0,0,0,done buddi surpris no option turn back bring back pic delet,11
22,1,3,0,0,1,0,speechtran http co twszx app store list best bi direct speech speech translat post twitter,15
25,1,0,0,0,0,0,chang look toggl wonder long take hip web app follow,10
23,1,0,0,3,0,0,want everybodi earth imessag anyway world imessag without give phone number,11
23,2,0,1,0,1,0,rt wall wall peopl secur huge line outsid get store http co ikhkgjm,13
14,1,0,0,1,1,0,whoa line store glendal iphon http co yzlpogxb,8
10,4,0,0,2,0,0,follow follow,2
24,1,2,0,0,0,0,salesperson soho store matter mani peopl line front not gon na get one iphon,14
17,1,0,0,0,0,0,look outsid see sticki note steve job,7
17,2,0,0,0,0,0,never rest battl court yet tablet not pill,8
19,1,0,0,0,0,0,iphon updat great serious let delet stuff dont want like gamecent steve wont mind,14
14,2,1,0,0,0,0,mine past warranti applecar io,5
13,1,1,1,0,0,0,could put usb femal connector car would dope,8
24,3,1,0,2,0,0,get flash ipad pleas pleas pleas chang mind thank advanc,10
26,2,0,0,0,0,0,perhap time come app call isuck let know app kill batteri life,12
7,2,0,0,0,0,0,min line store pump,4
11,1,0,0,0,0,0,lol support play mari blige wait time,7
12,2,0,2,0,1,0,rt sprint verizon store http co zozruuz,7
27,2,1,0,0,0,0,icloud new need weather stock pre io not hope help,10
23,2,0,0,0,0,0,think want android imessag servic interconnect would care user,9
15,1,0,0,0,0,0,austin domain locat umbrella nice staf properli would better,9
14,2,3,0,1,0,0,bore need new intrigu app ipad suggest yyc,8
21,4,1,0,1,0,0,fix bug thursday done updat thu issu spent fri io,10
24,1,1,1,1,0,0,still old mbp use run lion still like sync,9
20,2,1,0,1,0,0,find peopl stand middl blood soak room say siri told noreallyihearvoic,11
24,1,3,0,1,0,0,siri talk iphon ever know peopl realli truli crazi iphon siri appl,12
12,2,0,0,0,0,0,abl afford mansion one day,5
21,2,0,0,0,0,0,not know think io get make desktop app,8
11,2,0,0,0,0,0,wish hold music play pictur,5
10,2,0,0,0,0,0,yesterday upgrad help madden,4
25,1,0,0,0,0,0,hold last min realli like music select hold music white stripe ray lamontagn,13
20,3,2,0,1,1,0,win ipod touch get hello world babi memori app http co guofuz pampershelloapp,13
11,2,0,2,6,0,0,poor substitut siri yo gimmi siri,6
2,1,0,0,0,0,0,scrappl,1
23,2,0,0,4,0,0,oh no not want love love love lot dough spend otherwis,11
23,1,3,0,0,0,0,one great entrepreneur die steve job pass away heart go famili everyon,12
19,2,0,0,3,0,0,haha tomorrow less hectic caus everyon mom store today,9
18,0,1,0,0,0,1,took month decid tonight chosen googl amazon imag storag solut,10
12,1,3,2,0,0,1,rt today day ic lt android googl samsung,8
25,0,3,1,2,0,1,new nexu look good ui feel bit confus guess android user ok tri googl android nexusprim,16
16,0,1,0,0,1,1,nice trivia game googl help use search better http co iknz,11
17,0,2,0,0,1,1,nice trivia game googl help use search better http co ctudzk fb,12
13,0,2,0,1,1,1,cant build websit get googl websit free http co quyuou,10
18,0,2,1,0,0,1,android ic look pretti good not quit sure worth number leap googl,12
3,1,1,0,0,0,1,googl,1
25,1,4,1,1,1,1,rt android ice cream sandwich googl nexu new avtar http co mtutgx android googl nexu bigmama,16
14,1,2,1,0,0,1,rt excit day ice cream sandwich day googl android,9
20,0,2,1,0,0,1,wow new googl nexu beauti total gon na boost googl market share smart phone market,15
20,0,1,1,0,0,1,hahaha integr data usag manag sucha brilliant way sleek design superb watch video lol googl,15
16,0,2,1,1,0,1,fanci ice cream sandwich googl android wonder work htc desir,10
19,0,3,0,2,1,1,googl ice cream sandwich sound yummi think http co gmsgxcq googl android ice cream sandwich,15
2,0,1,0,8,0,1,googl,1
10,0,2,0,0,0,1,excit day ice cream sandwich day googl android,8
23,0,4,0,1,1,1,android ice cream sandwich googl nexu new avtar http co mswxeo android googl nexu bigmama,15
20,1,2,0,0,1,1,refer googl icecreamsandwich look amaz imo android miss http co renlzgi,11
16,0,3,1,0,1,1,http co qvmun forget phone nice ui like scroll featur android googl nexu,13
13,0,7,0,1,1,1,simpli amaz http co qmgira googl samsung galaxi nexu prime android icecreamsandwich,12
20,0,2,1,1,1,1,googl final unveil much await android os ice cream sandwich sure look good http co snlem,16
16,0,1,0,3,1,1,googl final search log user http http co rauerrtf,9
23,0,5,3,0,0,1,rim realli take debt look googl strategi releas ndk icecreamsandwich hour releas ic,13
15,1,4,1,2,0,1,rt man fallen love galaxi nexu googl samsung galaxynexu android,10
5,0,1,0,3,0,1,doubt googl,2
19,0,3,0,0,1,1,greader share five reason googl win war photoshar http co coqclbr photographi fotografia googl,14
25,1,1,2,0,0,1,rt dear googl want galaxi nexu pleas send email someth know technolog,12
22,1,3,1,0,1,1,rt telegraph report biggest threat facebook power user shift twitter googl http,12
13,0,4,0,0,0,1,sorri appl googl samsung made look bad android king,9
22,0,3,0,0,1,1,telegraph report biggest threat facebook power user shift twitter googl http co jhdtykcv,13
18,0,4,0,1,1,1,facebook power user gone googl twitter telegraph http co vwciovf socialmedia,11
21,0,1,0,0,0,1,not impress much new android updat good sign readabl font emphasi design less nerdi googl,15
11,0,1,0,0,1,1,video googl wallet see wow effect http co mcwvtg,9
19,0,1,0,0,0,1,tweet someth cant rememb spell go straight googl,8
23,0,1,1,0,0,1,dear googl want galaxi nexu pleas send email someth know technolog,11
9,0,3,3,1,0,1,googl android avail samsung nexu,5
22,1,1,0,0,1,1,mayb not effici way brows fun googl releas infinit digit bookcas http co xqzexf,14
17,1,1,0,0,0,1,difficult pass googl consid social seo benefit googl vs facebook,10
15,0,2,0,0,1,1,ice cream sandwich stop carrier bulli smartphon user googl android http co bznynn,13
12,1,1,0,1,0,1,agre hangout googl friggin awesom,5
19,0,2,0,0,2,1,http co plzeevh ice cream sandwich stop carrier bulli smartphon user googl android http co bgkimgjf,16
4,0,3,0,0,0,1,googl galaxynexu icecream great,4
11,0,2,0,2,1,1,next googl nexu phone http co edswoxoc,7
11,0,1,0,0,1,1,googl earth help locat salmonella hotspot http co mczrsdf googl,10
15,0,2,0,0,0,1,thingsweallh person act like know everi fuck thing bitch not googl,11
11,0,3,0,0,0,1,samsung galaxi nexu orbit laser appl iphon wooden stick googl,10
9,0,4,0,0,1,1,want http co srbmvk googl nexu samsung galaxi,8
21,0,3,0,0,0,1,ice cream sandwich realli delici ditch iphon sure googl launch android aka icecreamsandwich,13
3,0,1,0,0,0,1,googl lovin,2
21,0,1,0,0,1,1,samsung googl close collabor push mobil experi forward pleas http co ectfyia googl,13
13,1,3,3,2,0,1,rt final power volum screenshot no root requir googl ic galaxynexu,11
15,0,2,0,0,0,1,want new googl galaxynexu android go fuck,7
9,0,3,0,0,1,1,googl nexu press confer http co wvov slick,8
15,0,1,0,0,0,1,googl get high school colleg appreci,6
24,0,5,1,0,0,1,iscream scream scream android icecreamsandwich job well done googl major game changer mobil os space,15
5,1,1,0,0,0,1,googl alway think ahead,4
11,1,1,0,0,0,1,like googl virtual bookcas thank share,6
24,0,4,0,0,0,1,googl icecreamsandwich reveal get android whenev get new phone keep iphon,11
21,0,3,0,0,1,1,android googl ice cream sandwich featur closer look roboto type face pleasur read http co djspgb dhilipsiva,17
17,0,5,1,0,0,1,fantast work samsung googl galaxynexu superphon new android ic impress,10
17,0,2,0,0,0,1,think work melaleucathewellnesscompani probabl best compani work oh googl,9
3,0,1,0,0,0,1,love googl,2
13,0,2,0,0,1,1,wait ice cream sandwich http co rtdzjqu android googl,9
17,0,2,0,0,1,1,need hookup stop teas googl http co yrwl want new nexu,11
16,0,2,0,0,0,1,well googl icecreamsandwich new accompani phone usual neat noth ground break,11
19,0,3,0,0,1,1,android googl devic frame gener updat galaxi nexu screenshot got prettier http co bwtwz dhilipsiva,15
20,1,3,2,0,1,1,mmm smarterphon rt introduc ice cream sandwich delici new version android http co axlkg ic googl,16
15,0,4,1,1,0,1,excit new android featur awesom android ic googl galaxynexu,9
21,0,2,0,1,0,1,icecreamsandwich went way beyond expect wait get nexu play googl,10
20,1,3,0,0,1,1,check video introduc galaxi nexu simpl beauti beyond smart http co fitizia 透過 android nexu googl,16
13,0,1,0,0,0,1,cream insid clean outsid ice cream phone job googl,9
20,0,1,0,2,1,1,googl great small busi think platform realli benefici featur thought http co fytcyeg,13
21,1,4,2,0,0,1,rt love new present tool googl doc particularli theme ad video via url googl sd edchat ed,17
